"english","darija"
"Does anyone here speak English?","kayn chi wahd 8na kayhder bl anglais?"
"Don't do that","maddirch hakkak"
"Do you believe that?","wach katyye9 dakchi?"
"Do you have a pencil?","3ndk chi 9alam?"
"Do you smoke?","wach katkmi?"
"Excuse me, what did you say?","sm7 lia, chno glti?"
"Forget it.","nsa."
"How do you pronounce that?","kifach katnTe9 hadchi?"
"How do you say it in English?","kifach katgolo liha bl anglais?"
"I can swim","kan9der n3oum"
"I can't hear you clearly","kansm3ek mzyan"
"I don't mind","ma3ndi sou9"
"I don't think so","makanDench"
"I don't understand what your saying","mafhemtch chno katgol"
"Is there air conditioning in the room?","kayna chi klima fhad lbit?"
"I think you have too many clothes","kayballia 3ndk bzaf tl7wayj"
"I trust you.","kanti9 fik."
"I understand now.","fhemt daba."
"Let's meet in front of the hotel","ntla9aw gddam loTil"
"Please sit down","3afak gles"
"Please speak English.","3afak hder bl anglais."
"Please speak more slowly","3afak hder bchwia"
"Sorry, I didn't hear clearly.","sm7 lia, masm3tch mzyan."
"That's wrong.","hadchi ghalaT."
"Try to say it","jrreb tgolha"
"What does this mean?","chno kay3ni hadchi?"
"What does this word mean?","chno kat3ni had lklma?"
"Whose book is that?","dyalmn had lktab?"
"Why aren't you going?","3lach nta maghadich?"
"Why are you laughing?","3lach kaD7ek?"
"Why did you do that?","3lach drti hadchi?"
"Are you allergic to anything?","wach fik l7asasia dyal chi haja?"
"Are you ready?","wach nta wajd?"
"Are you ready?","nta wajd?"
"Are you ready?","wajd?"
"Did you send me flowers?","wach sifTTi lia lwrd?"
"Do you sell batteries?","wach katbi3 l batteriat?"
"I don't care.","ma3ndi kasar."
"I give up.","tansteslem."
"I got in an accident.","drt ksida."
"I have a cold.","drbni lbrd."
"I have one in my car","3ndi w7da f Tomobil"
"I made this cake","gaddit had l kika"
"I'm a teacher","ana ostad"
"I'm self-employed","ana khddam 3nd rasi"
"I still have a lot to do","ba9i 3ndi bzzaf mandir"
"I still haven't decided","mazal ma9rrert"
"It depends on the weather.","3la 7sab ljow."
"It's very cold today","lyoma bard l7al bzzaf"
"My luggage is missing","lbagaj dyali na9s"
"My stomach hurts","kaDrrni lm3da dyali"
"My throat is sore","l9rjota dyali mjrou7a"
"My watch has been stolen","tchfrat lia lmagana dyali"
"Take this medicine","khod had ddwa"
"The accident happened at the intersection","lksida w93at fin mla9yin Tro9an"
"There has been a car accident","w93at wahd lksida dyal tomobilat"
"Where can I exchange dollars?","fin n9dr nSerref dollar?"
"Where do you work?","fin khddam nta?"
"Where's the nearest hospital?","fin kayn a9rab SbiTar?"
"Where's the post office?","fin jat lbosTa?"
"And you?","onta?"
"And you?","onti?"
"Anything else?","chi haja khra?"
"Are they the same?","wach homa b7al b7al?"
"Are they the same?","wach homa kifkif?"
"Are you afraid?","wach nta khayf?"
"Are you going to attend their wedding?","wach ghat7Der ll3rs dyalhom?"
"Are you married?","wach nta mjowwej?"
"Are you okay?","wach nta labas?"
"Are you sick?","wach nta mrid?"
"Behind the bank.","mora lbanka."
"Can I borrow some money?","wakha tsllfni chi flous?"
"Can you call back later?","momkin tdowwer mn b3d?"
"Can you call me back later?","momkin tdowwer lia mn b3d?"
"Can you fix this?","wach momkin tgadd hadi?"
"Can you give me an example?","momkin t3Tini chi mital?"
"Can you speak louder please?","wakha thder chwia bjjehd 3afak?"
"Can you swim?","kat3ref t3oum?"
"Does he like the school?","wach 3ziza 3lih lmdrasa?"
"Do you accept Dollars?","wach kat9blo Dollar?"
"Do you have a girlfriend?","wach 3ndk Sa7btk?"
"Do you have an appointment?","wach 3ndk chi maw3id?"
"Do you have a problem?","wach 3ndk chi mochkil?"
"Do you hear that?","wach katsm3 hadchi?"
"Do you know how to get to the Mansour Hotel?","wach 3rfti kifach noSlo l hotel Mansour?"
"Do you know what this means?","wach 3rfti ach kay3ni hadchi?"
"Do you know where I can get a taxi?","wach 3rfti fin n9der nakhod taxi?"
"Do you know where my glasses are?","wach 3rfti fin kaynin nDaDri?"
"Do you like your co-workers?","wach kay3jbok nnas li khddamin m3ak?"
"Do you need anything else?","wach khassak chi haja khra?"
"Do you understand?","wach katfhem?"
"Give me the pen","ara lia l9alam"
"How do you know?","kifach 3rfti?"
"How is she?","kidayra?"
"How long is it?","ch7al tlw9t?"
"How many?","ch7al mn wa7d?"
"I have a lot of things to do","3ndi bzzaf tl7wayj mandir"
"In 30 minutes.","mn daba 30 d9i9a."
"Is anyone else coming?","wach kayn chi wahd akhor jay?"
"Is everything ok?","wach kolchi hoa hadak?"
"Is it cold outside?","wach bard l7al 3la brra?"
"Is it far from here?","wach b3id 3la 8na?"
"Is it hot?","wach skhoun l7al?"
"Is it raining?","wach katSbb chta?"
"Is there anything cheaper?","wach kayna chi haja rkheS?"
"Is your son here?","wach wldek 8na?"
"Should I wait?","wach ntsenna?"
"The big one or the small one?","lkbir olla ssghir?"
"The cars are American.","Tomobilat mirikanyin."
"Were there any problems?","yakma kano chi machakil?"
"Were you at the library last night?","wach knti f lmktaba llila li fatt?"
"What are you doing?","ach kaddir?"
"What are you thinking about?","fach katfkker?"
"What are you two talking about?","3lach kathDro ntoma bjoj?"
"What did you do last night?","ach drti llila lli fatt?"
"What did you do yesterday?","ach drti lbar7?"
"What do they study?","ach kay9raw?"
"What do you have?","achno 3ndk?"
"What do you think?","ach ballik?"
"What happened?","ach w93?"
"What happened?","chno lli w9e3?"
"What is that?","ach dakchi?"
"What is that?","chdakchi?"
"What should I wear?","ach khssni nlbs?"
"What's in it?","ach fiha?"
"What's the temperature?","ch7al darajat l7arara?"
"What's this?","ach hada?"
"Where are you from?","mnin nta?"
"Where can I rent a car?","fin n9dr nkri chi Tomobil?"
"Where did it happen?","fin w93at?"
"Where did you learn it?","fin t3llemtiha?"
"Where is he?","finahoa?"
"Where is he from?","mnin hoa?"
"Which is better, the spaghetti or chicken salad?","chno lli 7sen, spaghetti ola chlaDa dyal djaj?"
"Which one do you want?","achmen w7da bghiti?"
"Which one is cheaper?","chkon fihom lli rkheS?"
"Which one is the best?","chkon fihom lli 7sen?"
"Which school does he go to?","achmn mdrasa lach kaymchi?"
"Who are they?","chkonahoma?"
"Who are you looking for?","3lamn kat9lleb?"
"Who is it?","chkon m3aya?"
"Who's calling?","chkon lli kayDowwer?"
"Who's that man over there?","chkonahoa dak rrajl lli lhih?"
"Who taught you that?","chkon 3llmek dakchi?"
"Why did you say that?","3lach glti dakchi?"
"Will you pass me the salt please?","wakha tdowwez lia lml7a 3afak?"
"Will you put this in the car for me?","wakha t7TT lia hadi f Tomobil?"
"Would you ask him to call me back please?","wakha tgollih iDowwer lia 3afak?"
"You have a very nice car.","3ndk Tomobila ghzala."
"You look like my sister","katchbb8i l khti"
"6 dollars per hour.","6 dollar l ssa3a."
"50 dirham per hour","50 drhem l ssa3a"
"Are you waiting for someone?","wach katsnna chi 7dd?"
"Are you working today?","wach nta khddam lioma?"
"Bring me my shirt please","jib lia m3ak trikkoya 3afak"
"Do you like to watch TV?","wach kay3jbek tfrrej f tlfaza?"
"Have you finished studying?","wach kmmelti l9raya?"
"He's an Engineer","hoa ingenieur"
"How long have you worked here?","ch7al hada bach nta khddam 8na?"
"How many hours a week do you work?","ch7al mn sa3a f ssimana katkhdem?"
"How much money do you have?","ch7al t lflous 3ndk?"
"How's the weather?","kidayr ljow?"
"How was the trip?","kidazt lkhrja?"
"I forget.","nsit."
"I'm good.","ana mzyan."
"I'm ready.","ana wajd."
"I still have a lot of things to buy.","ba9i khassni bzzaf tl7wayj nchrihom."
"I've seen it","chftha"
"What does he do for work?","fach khddam howa?"
"What does your father do for work?","fach khddam lwalid dyalk?"
"What does your father do for work?","fach khddam babak?"
"What do you do for work?","fach khddam nta?"
"What do your parents do for work?","fach khddamin walidik?"
"What time do you go to work everyday?","m3ayach katmchi l khdma kola nhar?"
"When do you get off work?","imta katkhrej mn lkhdma?"
"When do you get off work?","fo9ach katkhrej mn lkhdma?"
"Where did you put it?","fin 7TTitih?"
"Where does it hurt?","fin kayDrrek?"
"Where does it hurt?","fin kay3Tik SSda3?"
"Where do you want to go?","fin bghiti tmchi?"
"Come here","aji l8na"
"Does it often snow in the winter here?","wach kayTi7 tlj bzzaf f chtwa 8na?"
"Do you think it'll rain today?","wach katDenn khaTTi7 chta lioma?"
"Do you think it's going to rain tomorrow?","wach katDenn ghadi Ti7 chta ghdda?"
"How's business?","kidayra lkhdma?"
"Is it close?","wach msdoud?"
"Is it possible?","wach momkin?"
"Is it ready?","wach wajd?"
"It costs 20 dirhams per hour.","kayswa 20 drhem l ssa3a."
"It's far from here","b3id 3la 8na"
"It's going to be hot today.","ghaykon skhoun l7al lioma."
"It's north of here.","f chamal dyal 8na."
"It's over there.","l8i8."
"It's raining","chta kaTTi7"
"It's too late","mcha l7al"
"It's very important","mohimm bzzaf"
"It will arrive shortly","9rib yoSl"
"The roads are slippery","Tro9an kayzll9o"
"What will the weather be like tomorrow?","kighadi ikon ljow ghdda?"
"Hasna is Karim's girlfriend","Hasna sa7bt karim"
"Hasna is Karim's wife","Hasna mrt karim"
"Hasna is Karim's mother","Hasna mmt karim"
"He always does that for me","dima taydir lia hadchi"
"He broke the window","8rrs chrjem"
"He doesn't look like a nurse","makaybanch b7al chi frmli"
"He has a nice car","3ndo Tomobila wa3ra"
"He never gives me anything","ma3mmro 3Tani chi haja"
"He said this is a nice place","gal hadchi f wahd lblaSa zwiwna"
"He's an American","hoa mirikani"
"He's a very good student","hoa tlmid zwin"
"He's faster than me","hoa sra3 mnni"
"He thinks we don't want to go","kays7ab lih mabghinach nmchiw"
"His room is very small","bito sghir bzzaf"
"His son","wldo"
"How are your parents?","kidayrin lwalidin dyalk?"
"How do I use this?","kifach ghanst3ml hadchi?"
"I came with my family","jit m3a l3a2ila dyali"
"I came with my family","jit m3a ddar"
"I'd like to exchange this for Dollars","bghit nSrrf hadi l ddolar"
"I'd like to use the internet","bghit nkhddm l'internet"
"I don't have time right now","ma3ndich lw9t daba"
"I don't know","ma3rftch"
"I have money","3ndi lflous"
"I haven't had lunch yet","mazal matghdditch"
"I like Italian food","3ziza 3lia lmakla t Talyan"
"I live in Chichawa","kan3ich f Chichawa"
"I'll talk to you soon","daba nhDr m3ak mn daba chwia"
"I made a mistake","drt wahd lghalaT"
"I made a mistake","drt wahd zzBla"
"I'm bored","kan7ss blmalal"
"I'm going to Europe next year","ghanmchi l europpa l3am jjay"
"I'm going to go have dinner","ghanmchi nt3cha"
"I'm tired","3yit"
"I'm very well, thank you","ana mbrre3, chokran"
"I need another key","khasni sarout khra"
"I need this to get there by tomorrow","ana m7taj hadi bach noSl tmma ghdda"
"I need to go now","khssni nmchi daba"
"Is it suppose to rain tomorrow?","wach ghadi tti7 chta ghdda?"
"Is Hamza there please?","kayn Hamza 3afak?"
"Is this a safe area?","wach had lblSa aamina?"
"Is this Mr. Mohamed","wach hada ssi Mohamed?"
"Is this the bus to Koutoubia?","wach hada Tobis lli tayddi l Koutoubia?"
"Is this your book?","wach hada ktabk?"
"I still have to brush my teeth and take a shower","ba9i khssni nghsel snani o ndowwech"
"Is your father home?","kayn bbak f ddar?"
"I think those shoes are very good looking","kayballia had ssbbaT mbogS"
"It's very windy.","kayn l3jaj bzzaf."
"It takes 2 hours by car","ghaykhss 2 tsway3 b Tomobil"
"I've never done that","ma3mmrni drt hadchi"
"I've worked there for five years","khdmt tmma khms snin"
"I want to buy something","bghit nchri chi haja"
"I want to contact our embassy","bghit n contacti ssifara dyalna"
"I want to send this to the United States","bghit nsifT hadchi l mirikan"
"I want to show you something","bghit nwrrik chi haja"
"My car isn't working","Tomobilti makhddamach"
"Nobody is helping us","tta wahd makay3awnna"
"Nobody is there right now","tta wahd makayn tmma daba"
"Open the door","7ll lbab"
"Open the window","7ll chrjm"
"Pick up your clothes","8zz 7wayjk"
"Please count this for me","3afak 7sb lia hadchi"
"Please tell her her mom called","3afak golliha rah mamaha dwwrat"
"Please tell me","3afak gollia"
"Please wait for me","3afak tsennani"
"She's going with me tomorrow","ghadi tmchi m3aya hia ghdda"
"Some books","chi ktouba"
"Someone is coming","chi 7edd jay"
"Sorry, I don't have a pencil","sm7 lia, ma3ndich stylo"
"Start the car","dimari tomobil"
"Tell him that I need to talk to him","gollih rah khssni nhder m3ah"
"That car over there is mine","dik tomobila lli lhih rah dyali"
"That's a good school","hadik mdrasa mzyana"
"That's her book","hada ktab dyalha"
"That's not enough","hadchi makafich"
"The car is fixed","tomobil tSawbat"
"These books are ours","had lktouba dyawlna"
"They haven't met her yet","mazal matla9awch m3aha"
"They're planning to come next year","rah kaywjjdo ijiw l3am jjay"
"They're waiting for us","rah kaytsnnaw fina"
"They're waiting for us","rah kaytsnnawna"
"Those men are speaking English","hadok rrjal kayhdro bl anglais"
"What color is that car?","achmn loun dik tomobil"
"What do you think of these shoes?","kijak had sbbaT"
"When would you like to meet?","imta bghiti ntla9aw?"
"Where does your wife work?","fin khddama mrtk?"
"Where is my shirt?","finahoa trikkoya?"
"Where is the bus station?","fin jat blaka t Tobis?"
"Which road should I take?","achmn Tri9 khss nakhod?"
"You're right.","3ndk l7e99."
"Your house is very nice","darkom zwina bzzaf"
"do not worry","safi t8nna"
"do not worry","kon 8ani"
"no worries","hania"
"watch out","rdd lbal"
"watch out","kon 3la bal"
"this is my book","hada ktabi"
"that is our building","hadik 3imartna"
"give me her money","3Tini flous8a"
"I hear their dog","kansme3 klb8om"
"it's his life","hadik 7yato"
"it's none of your business","machi chghlk"
"This lift is often breaking","had lmas3ad kaykhsr bzef dyal lmrat"
"I don't know how much it's your fault, but if we stay stuck in that elevator long, you can work there.","ma3arfch 9dach lghalat dyalk, walakin ila b9ina wa7lin fhad lmas3ad bzef dyal lwa9t, t9der tkhdam tma."
"I know you have your computer with you, it's perfect.","ana 3aref bli rah l PC kayn m3ak, hwa mazyan bzef."
What are you thinking I should be able to climb twenty floors because I m so fit?,ach banlik wach ana khasni nkon 9ader ntla3 3chrin tab9a 7it ana S7i7?
"I don't know exactly which floor if you find your office, you know.","ma3arafch achmn taba9 ila l9iti lmktab dyalk, rak 3aref."
I'll have to ask Archibald to handle this urgently.,ghadi ikhssni ntlab Archibald iSawb hadchi bzerba.
"Anyway, I'm glad it's you that I'm stuck with in this elevator, and not Souad.","3la kol7al,ana far7an nta lli wa7alt m3ah flmas3ad, omachi Souad."
He would have been unbearable.,i9der ikon makaydkhlch lkhater.
"Hello, yes I'm feeling very anxious.","salam, ah kn7es bli m9ala9 bzef."
This is my first time flying and I'm not sure what to expect.,hadi awal mra ghadi nsafer f Tyyara o mamt2akedch ach ghadi nmtwa93.
"It's my first time, too, it's crazy!","hadi awal mra lia, 7ta ana, hadchi kay7ama9!"
That's terrible and knowing that doesn't help my nerves.,hadchi khayeb bzef o mli kt3ref hadchi makay3awnch a3sab dyali.
"Tell me about it, I'm sure it's a placebo what he gave you.","gol lia 3la dakchi, ana mt2aked bli dwa wahmi li3tak."
What a pair we are!,ach had zoj 7na!
Maybe a drink will calm us.,kandn chi charab i9der i8ada2na.
How about a whiskey?,ach ballik f whiskey?
That sounds good.,hadchi kayban mazyan.
"Or if they haven't got a whiskey, a brandy.","o ila ma3ndhoumch whiskey, brandy."
I'm going to a seminar on the fear of the plane.,ana anmchi lnadwa 3la lkhowf mn tayara.
I hope it helps!,kantmna y3awn!
Maybe they'll give us a drink!,kandn i9der i3tiwna charab!
Your seminar sounds interesting.,nadwa dyalk katban mohima.
The test of your seminar will be when you have to fly back!,lmti7an dyal nadwa dyalk ghadi ikon mli aykhsek trje3!
You're not talking about the Lithuanian?,nta makaddwich 3la hadok li mn lithuania?
"Don't worry, I'm sure we'll all be there, your friend there.","mat9ll9ch, ana mt2aked bli ghadi nkono tma kamlin, sa7bek tma."
Fingers crossed.,tchbak sab3an.
Enjoy your seminar.,tmata3 b nadwa dyalk.
"He's scheduled to be completely in Lithuanian, and I will understand nothing.","khatat bli ghadi ikon kamlo blogha lithuania, omaghadi nfhem ta7aja."
"Hello, what can you lose in this evil forest?","salam, achno ghadi tkhser f had lghaba chirrira?"
How are you planning on getting out of this?,kifach katkhatat tkhroj mn hadchi?
Then we can try to call for help by building a musical instrument.,mn b3d imken lina n7awlo nTlbo lmosa3ada b n9ado 2ala dyal mosi9a.
Because here I don't have a signal,7it 8na ma3ndich ichara
Do you like her?,wach nta 3ziza 3lik?
But why a musical instrument?,walakin 3lach 2ala dyal lmosi9a?
Wouldn't a wolf whistle work better?,wach maghadich tkhdem sfara dyal di2b 7san?
Because an instrument allows us to communicate remotely without a signal.,7it 2ala katkhlina ntwaslo mn b3id bla ichara.
"Based on the traditional method of communication, we might be able to get us out of this.","mn tari9a dyal l2itisal ta9lidia, n9dro nkhrjo mn hadchi."
"I'm not sure what a wrong is, but if you really think you can do it, go ahead.","mamt2akedch chnahwa lkhata2, walakin ila knti kadn t9der ddiro, bda."
What kind of instrument were you thinking of?,achmn no3 dyal l2ala li knti katfker fiha?
A wooden one I suppose...,chi wahd khachabi kanDnn...
"We can make a Tam Tam, but we need buffalo skin!","n9dro n9ado TAM TAM, walakin aykhsna jald dyal ljamos!"
We can use the smoke to communicate in Morse code.,n9dro nkhdmo b dokhan bach ntwaslo f chifra dyal Morse."
Unless you know of a buffalo shop around here?,mnghir ila knti 3aref chi ma7al dyal ljamos hna?
Although you may be onto something with your idea of the fire.,wakha i9der tkon 3la chi 7aja m3a lfikra dyalk 3la l3afia.
"Haha, there's no store like this.","haha, makaynch 7ta chi ma7al b7al hada."
Because moving blind with a wounded knee doesn't seem like a good idea to me.,7it t7rek bla matchof m3a jar7a frakba makatbanch bli fikra mazyana.
"We'll leave the basics if we need to, but we can't give up.","ghadi nkhliw l7ajat lmohima ila kan khasna, walakin maghadich nstaslmo."
"Wow, I thought you would tell me that we need the basics!","wow, knt kandn wach ghadi tgol lia bli 7na ma7tajin l7ajat lmohima!"
I always have some leftover bread and I like to come here and enjoy the quiet.,3ndi dima chwiya dyal lkhobz likayb9a o3ziz 3lia nji l8na o ntmata3bl8odo2.
"I'm a computer engineer, and I work from home, too.","ana mo8ndis f informatique, o kankhdam mn dar, 7ta ana."
I guess it saves you from being harassed.,kandn bli kay7mik bach matb9aych t3arrdi lmodaya9a.
Medicine and healthcare and our National Health Service which is always in the news for not having enough money to keep it going,TTib w rri3aya ssi7ia w lkhidma asi7ia alwatania lli tatkon dima fl2akhbar 7itach mafihach flos kafia bach ikmmlo
It's not bad and varied as work!,machi khayeb o mkhtalf b7al lkhdma!
"It's pretty cool in every day, it's true.","8wwa zwin kol nhar, hadchi s7i7."
This is my first time flying.,hadi awal mra ghadi ntir fiha.
This is my first time flying.,hadi awal mra ghadi nrkb fiha f tyyara.
"Don't worry, everything's going to be fine!","mat9ala9ch, kolchi ghadi ikon bikhir!"
How can you be so sure?!,kifach 9derti tkon mt2aked lhad daraja?!
"That's what pilots do, not anyone you know!","hadchi likaydiro lpilotat, makat3ref ta7ed?"
They do years and years of studying!,kaydiro bzaf dsnin dyal l9raya!
Does it get any easier?,wach hadchi kaywlli as8al?
"Let's see, a little bit of courage.","yalah nchofo, chwiya dyal chaja3a"
All we have is 12:30.,3ndna ghir 12:30
I usually do most of my homework and I do turn up generally,ana marra marra kandir aghlab ttamarin dyali o 3omoman kan7dr
"I could sing a funny English song about dead bodies, the worms go in and the worms go out","n9dr nghani oghniya mod7ika 3la jotat maytin, ddoud kaydkhl o kaykhrj"
I'll have to try and remember it from when I was younger,ghadi njarreb ntfakkar mnin kont sghir
"Oh and no I ve not been drinking, not even tequila with a worm in the bottom of the bottle!","oh o ana makntch kanchrb, 7ta tikilaa m3a doda f 9a3 l9ar3a!"
I just checked and you can find the song on youtube,rah yalah 9alabt o ta9dr tal9a l oghniya f youtube
Maybe we should have some tea together and that may help our relationship,imkan khasna chi atay bjojna o hadchi ya9der y3awen l3ala9a dyalna
it is dispiriting,rah mo7bit
"We do have various activities, I ask you!!","3andna anchita makhtalfa, kansawlk!!"
I remember you telling me she wasn't so good.,kantfkr glti liya makantch zwina.
Are you always so satisfied with your retirement home?,wach nta dima raDi bdar dyal ta9a3od dyalk?
I think I remember that the food is not very good.,kandn anni tfakart bila lmakla mazwinach bzaf.
And here even there's nothing?,o hna wakha makayn 7ta 7aja?
It seems to me that the last time a lecturer was supposed to be speaking of ancient Egypt.,kayban liya bila akhir mra kan mn lmoftarad lmo7aDir yadwi fiha 3la miSr l9dima
"I do play the piano",ana kan3zef 3la lpiano
Have a good journey home,kantmana lik ri7la zwina ldar
She said afterwards to me she was going to get a restraining order against him,galt liya moraha bila ghadi ta7Sl 3la 2amr ta9yidi Dado
"You could try to convince the big pervert this Anya only wants her money, and that you're the only person who really loves her!","yamkn lik t7awl t9na3 chirir lkbir bhad Anya bghat flos8a safi, o nta chakhS lwa7id likaybghiha bssa7"
"That could work, old people are sometimes very paranoid.","hadchi i9dr yanja7, nas lkbar kaykono khayfin bzaf"
What a good idea!,fikra mazyana!
I just want to take a long hot shower and have a beer.,ana faqaT bghit nDrb chi 3oma skhona o chi birra
I stayed warm with the dog.,b9it skhoun m3a lkalb
"As long as you're not asking me to watch football and warm up a frozen pizza","ma7dd makaTlebch mni tfaraj f kora o tsakhen pizza mjamda"
"you can stay as long as you want in the shower and drink your beer","yamkn lik tb9a lwa9t libghiti f l7ammam o tchrab lbirra dyalk"
"He needs to get used to bad weather","khasso ywallef 3la ljaw lkhayb"
"we are planning to move to the west coast of Brittany after all!","7na kankhaTo bach nta9lo lsa7el lgharbi dyal Britanya mn ba3d kolchi!"
"Not at all, you plan to move to Laguira","la niha2iyan, nta katkhaTaT tnta9l l Laguira"
In any case the weather in Marrakech is wonderful,"3la kol 7al, ljaw f Marrakech zwin"
"I hate this country, or it does a terrible time 9 months a year.","tankreh had lbalad, ola kaydawz wa9t khayb 9 chohor f l3am"
It is far less humid and the northern lights are beautiful,ra8a a9al rotoba bzaf o aDwa2 chamaliya zwina
"Maybe for popsicles, but not for me.","Momkin 3la 9bl lmaSaSat, walakin machi bnasba liya"
"I will always be on a cruise to the polar circle","ghadi nkon dima f ri7la ba7riya lda2ira l9otbiya"
"Excuse me, north of Asfi.","sma7 liya, chamal dyal Asfi"
You want me to bring your juice in your bath?,bghitini njib lik l3aSir dyalk l7ammam dyalk
That would be great,hadchi ghadi ykon 3aDim
Hello,salam
Flat White?,9ahwa biDa?
Americano?,Amricano?
Are you visiting the town? I don't think I have seen you in here before,wach hi dayz mn lmdina? makanDnnch fayt chaftk 8na mn 9bal
All right,ma3ndi mangol
The art gallery is just a hundred metres from the bar,ma3riD lfanni b3id 100 mitr 3la lbar
"Otherwise, I just had a taste of your white-mouth coffee.","bl3aks, yalah da9t ghir daba l9ahwa dyalk lbayda."
Not so good.,machi mazyan bzaf.
Right I'll do that and then I need to serve the customer who has just come in.,wakha ghadi ndiro o man ba3d ghadi n7taj nsrbi lklyan lli yalah ja.
Thanks very much for your help.,chokran bzef 3la lmo3awana dyalk.
"Aww thank you, that's so kind of you to say!","Aww chokran lik, hadchi liglti loTf mn 3andak!"
"Especially Sttati, he's my favorite.","Khasatan Sttati, hoa afdal wahd 3andi."
"Oh yes, I met Latifa on my way in, she did seem very nice","Oh ah, tla9it m3a Latifa ftri9i, bant lya drayfa bzef"
And my son Jilali still helps out as much as he can,o waldi Jilali mazal kay3awn ch7alma 9dar
Do you remember Julian?,Wach ba9i 3a9al 3la Julian?
"But it must take her some time, to take care of you.","walakin rah kaykhas chawya dyal lwa9t, bach trad lik lbal."
The duck jam with the cranberry jam.,kofitir dyal albat m3a kofitir dyal tot albari.
"It's hard to cook the duck","S3ib tayab lbaTT"
"especially when you make a lot for a lot of people","khasatan mli kaddir bzaf l bzzaf dyal nas"
"but here, the cook can do very well!","walakin 8na, TTyab imkn ikon mazyan bzaf!"
"And you know how much I like butter and cheese and rich, tasty foods","onta kat3ref ch7al kanbghi zabda o jban o lmakla lghanyya, olldida"
"My neighbor Hamza only eats bowls of soup, that's true.","jari Hamza kayakl ghir zlayf dyal soba, hadchi s7i7."
Do you want to go to the common room for a cup of tea?,"wach bghiti tmchi llbit lmochtarak, bach tchrab kas dyal atay?"
"Haha, you crack me up!","Haha, rak 8rastini!"
"Oh, yeah, that's a good idea.","Oh, ah, hadi fikra mazyana."
Oh wow you really do like Lina a lot!,Oh anta kat3jbek Lina bzaf!
"If you move in here, we could live together!","ila nta9alti l8na, n9dro n3icho bjouj!"
"We could try, my dear!","imkn lina n7awlo, 3azizati!"
Here's Lamia.,hahya Lamia.
That's not a very Christian idea!,hadi machi fikra masi7ia bzzaf!
"By the way, I hope you didn't invite Ihsan.","blmonasaba, kantmnna tkon ma3rdtich 3la Ihsan."
Oh... who should I invite?,Oh...chkon likaykhasni n3rad 3lih?
I don't have many friends except Mona...,Ma3ndich bzaf dyal SS7abat mn ghir Mona...
Ow!,ow!
"I'm warning you, it's her or me.","ana kan7drak, rah hia ola ana."
