"english","darija"
We could camp here for the night and hope we can find our way in the morning when it's light,n9adro nkhaymo 8na lil kaml o kantmnaw nl9aw Tri9na f sbah mnin ykon DDo
"Yeah, that's a good idea, but we don't have a tent","ah fikra mzyana, walakin ma3ndnach khima"
Did you see a place to shelter nearby?,wach chafti blaSa fin ntkhbbaw 9riba?
I think we're just going to have to build it,kanDn bila khasna fa9aT nbniw8a
we hope there are no wild animals in the forest,kantmanaw mtkonch 7ayawanat bariya f lghaba
Did you ever learn to make a fire with a flint?,wach 3mmrek t3alamti tcha3al l3afya b sowan?
"Yes, let's hope so","ah, khlina n2amlo hadchi"
Do you have any sugar?,3andak chi skkar?
"No, I'm afraid not",la la m3ndich
Can you hear that noise?,wach ta9dar tasma3 had Sda3?
It's a bit scary,rah mokhif chwiya
I hope it's someone who has come to rescue us!,kantmana ykon chi 7add lija y3ta9na
Wolf howl?,3iwa2 di2b?
Maybe,momkin
"I'm afraid I've seen a wolf or a big stray dog before",ana khayf chaft di2b wla kalb kbir mn 9bal
"I have three boxes of matches in my left pocket","3andi tlata tlbwaTat t lou9id fjibi lisr"
That's a bit of good news about the matches,hadi chwiya dyal lkhbarat zwina 3la lou9id
Animals don't like fire,l7ayawanat makatbghich l3afya
I can give them,n9dr n3Tihom
they are too close,homa 9rab bzaf
Have you got anything to give them?,wach 3andak chi 7aja ta3tiha lihom?
I'm gonna make a fire to get them away,ghadi ncha3al l3afya bach nba3adhom
Would you like some tea or coffee?,wach bghiti chwiya dyal atay wla l9ahwa?
I got some hot water left in my thermos,rah khlit chwiya dyal lma skhon f termos
"Yes please, that would be great","ayeh 3afak, ghadi ykon hadchi zwin"
"I've got some chocolate biscuits left too",3andi 7ta chwiya dyal biskwit dyal choklat ba9i
"although they've melted a bit in the heat",wakha rah dab chwiya f l7arara
Light the fire quick!,cha3al l3afya bzarba
"My matches are all wet",ga3 lou9id sard lil2asaf
"My matches are all wet",ga3 lou9id fazg lil2asaf
"I hear voices nearby","kansma3 aswat 7dana"
What a relief!,wa 3la ra7a
What a relief!,lah 3la ra7a
I didn't want to die here!,makntch bghit nmot hna
I don't want to die here!,mabghitch nmot hna
Want to play a game?,bghiti tl3ab chi lo3ba
"Not at the moment, I'm enjoying the sun and relaxing","machi fhad lwa9t, ana kanstamta3 bchamch o kantarkha"
Not at the moment,machi daba
Not at the moment,machi droka
Maybe later,yaqdar fwa9t akhor
later,mn ba3d
You're not gonna stand there and do nothing!,maghadich tb9a wa9af tmma o makadir walo
I'm too hot to do anything at the moment,ana skhon bzaf bach ndir chi 7aja fhad lwa9t
Can you get me a nice cold drink with some ice please,wach t9dr tjib liya machrob bard m3a chwiya dyal talj 3afak
"It's okay that you're warm, you're in the sun","machi mochkil tkon skhon, rak kayn f chamch"
"Okay, I'll get you your drink",wakha ghadi njib lik chrabk
You want some water?,bghiti chwiya dyal lma?
I was thinking of something a bit more exciting,knt kanfakar fchi 7aja aktar itara
"you shouldn't drink in the sun","makhsskch tchrab fchamch"
Why?,3lach?
Is it bad for me?,wach hadchi khayb liya?
You might get drunk faster,ta9dar tskr bzarba
"it might even be dangerous to go in the pool!",ya9dar ykon khaTir tchmi lmasba7
I've not heard of that before,masma3t bhadchi mn 9bal
Perhaps I should eat something as well,imkn khasni nakol chi 7aja ta8ia
Did you notice any food available at the bar?,wach chafti chi makla kayna f lbar?
"Yeah, I think there's some sandwiches","ah, kanDn kayn chi sandwichat"
I'll do a deal,ghadi ndir Saf9a
"If you get me a sandwich, I'll play a game after","ila jabti liya sandwich, ghadi nl3ab m3ak lo3ba mn b3d"
All right!,wakha!
All right!,mchat!
All right!,Sla 3la nnbi!
All right!,wa 3ayalh!
Here's your sandwich!,hahoa sandwich dyalk
"Didn't you get something for yourself",wach makhditich lik chi 7aja
"you must be hungry?","ghatkon ji3an?"
"you must be hungry?","ghaykon fik jou3?"
"While I was making your sandwich, I got one, too","o ana kan9ad sandwich, khdit wa7d ta ana"
Nice of you to ask,zwina mnk tsawal
thanks for asking,chokran mlli sowelti
Shall we play badminton or tennis?,wach nl3bo korat richa wla tinis
It's my favorite sport,hia riyada lmofaDala dyali
Sounds like you are good,kayban liya nta mazyan
I'll get the racquets,ghadi njib lmaDarib
I'll get the racquets,ghadi njib rakitat
I've had a terrible day,rah dwzt nhar S3ib
Hope the cat isn't around or I will kick it,kantmana matkonch lmcha tmma wla ghadi ndrabha
Horrible?,ra8ib?
But that's no reason to take it out on our cat!,walakin hada machi sabab bach nsbboha f lmcha dyalna
First the train was late so when it came it was full and there were no seats left,"awalan, t3atal tran, o mnin wsal kan 3amar o makanoch blays khawyin"
Then when I apologised for being late I realised I had left my papers at home,"o mnin 3tadart 3la ta3tal dyali, tfakart khlit wra9i fdar"
Keep the cat out of the way!,ba3d lmacha mn Tri9
I see,kanchof
Then I realised I had got your glasses and not mine,mn ba3d 3raft bila khdit nDaDrk o machi nDaDri
Hope you weren't too annoyed by that,kantmana matkonch m9ala9 mn hadchi
Have you been able to participate in the meeting anyway?,wach 9darti tchark b3da f ijtima3?
"Oh, yeah, I saw about the glasses","oh, ah rah chaft nDaDr"
"but I didn't have to drive",walakin makanch 3liya nsog
"so that didn't embarrass me too much","dakchi 3lach ma7rajnich dakchi bzaf"
Someone said I was better than usual but I think they were just poking fun at me,galiya chi 7ad bila knt 7san mn 9bal walakin kanDn kano kayda7ko 3liya
You think they made fun of you?,wach kadan bila kano kayD7ko 3lik?
It's not certain!,hadchi machi m2akad
"And, as you know very well, you had to be perfect!",o 7ta nta kat3raf bila khasak tkon mitali
"No, maybe I'm just paranoid","la, imkn hir ana mr3oud"
But when we got in the lift my boss started to tell me this story,"walakin mnin rkabna lmas3ad, bda ra2is dyali kay3awad liya dik l9iSSa"
then the lift broke down between floors,mn ba3d khsar lmas3ad bin tawabi9
And then the lift broke down between floors,o mn b3d khsar sansour bin liTajat
I was stuck in the lift with my boss!,w7alt flmas3ad m3a ra2is dyali
Now your're making fun of me,nta daba kadhak 3liya
"Well, I think you've had a really bad day, and you're mostly in a bad mood","wakha, kanDn bila dawzti nhar khayb, onta ghaliban f mazaj khayb"
While the lift was stopped he said we should use the time doing my appraisal!,"mnin w9af lmas3ad, galiya bila khasna nstaghllo lwa9t f ta9yim dyali"
I'm always in a bad mood,ana dima fmizaj khayb
I'm always in a bad mood,ana dima Tal3a lia l9rda
"Sorry, I haven't asked how your day was?",sma7 liya masawltkch kidaz nhark?
"you're not always in a bad mood","nta machi dima fmizaj khayb"
"but tonight, you definitely are!","walakin had llila, bta2kid"
At the same time,fnafs lwa9t
"after the day you've passed, that makes sense","mora lyoum lidawzti, hadchi Tabi3i"
I had a good day,daz 3andi lyoum mazyan
I had a good day,lyoum daz mazyan
That's probably why I see things more serene,ghaliban hadchi 3lach kanchof l7wayj b8odo2
"I would go for a lie down to calm down a bit, but I see the cat is on the stairs",knt ghadi ntaka bach nthadan chwiya walakin knchof lmcha f droj
Have you left any wine or have you finished the bottle?,wach khliti chwiya dyal nabid wla kmmlti l9ar3a?
"leave that poor cat alone",khali dik lmacha maskina
"leave that poor cat alone",fout 3lik dik lmcha mskina
"take a glass of wine",khod kas dyal nabid
Thanks I will have a big glass and try to forget about the day,"chokran, ghadi nakhod kas kbir o n7awal nsa lyoum"
What would I do without a sympathetic ear when I get home,chno ghadi ndir bla wdan mat3atfa mnin nrja3 ldar
"Hi, this is my first time flying and I have to admit that I'm a bit nervous","ahlan, hadi lmrra lawla likansafar fiha bTayara o khasni n3tarf bila matwatar chwiya"
Have you flown before?,wach safarti fsma mn 9bal
Yes,ah
I take it very often!,kanakhod8a bzaf tlmrrat
Almost every week for my work,ta9riban kol simana lkhadma dyali
"You'll see, the journey will go well, I'm sure!","ghadi tchof, ghadi doz ri7la 3la khir, ana mat2akad"
I'm quite scared in fact,ana khayf chwia sara7a
What is that strange noise and shaking?,ach had sda3 o irti3ach lgharib?
It's perfectly normal,rah Tabi3i tamaman
"I was very scared, too, when I started getting on the plane ten years ago",knt khayf bzaf ta ana mnin bdit kanrkab Tayara 9bal 3chr snin
And I even trained to learn how to not be afraid of flying!,7ta tdarabt 3la kifach mankhafch mn Tayaran
that's reassuring,hadchi kayTam2an
Maybe I should order a drink,imkan khasni nTlab machrob
Would you like one?,bghiti wa7da?
It's a good idea to relax!,fikra mzyana annak tarkha
But I'll have a coffee instead,walakin ghadi nakhod 9ahwa blastha
"I got up a little early to get on the plane","a9t bkri chwiya bach nrkab Tayara"
"I need that coffee to wake me up a bit!","khssni dik l9ahwa bach nfi9 chwiya"
I'll grab the stewardess when she passes,ghadi ngolha lmoDifa mnin douz
Would you like anything to eat with your coffee?,bghiti takol chi 7aja m3a l9ahwa dyalk
I could eat a croissant with coffee,n9dar nakol crwasa m3a l9ahwa
"Good idea, I'll get one too","fikra mzyana, ghadi nakhod 7ta ana wa7da"
I usually only eat croissant on special occasions,ana asasan kanakol karwasa flmonasabt lkhasa safi
I'm a chocolatier,ana kansayab choklat
Flying for the first time is a bit of a special occasion,Tayaran l2awal mra rah monasaba khaSSa
Oh wow!,"oh, waw"
What a dream job,ay 3la khdma dyal l2a7lam
"But since I'm a bit greedy, I tend to eat croissants often!","walakin 7it ana Tmma3 chwiya, rah kanmil nakol karawasa bzaf"
"Yes, it's a fantastic job!","ah, rah waDifa zwina"
Which chocolate company do you work for?,achmn chrika dyal choklat fach khdam
"I'm an auto contractor, and I'm working on my account.","ana mo9awil dati, o kankhdam lrasi"
"I'm not sure what that means, but you are definitely someone to stay in touch with!!","mamt2akd ach kay3ni dakchi, walakin nta bta2kid chi 7ad t9dar tb9a 3la itisal m3ah"
I adore chocolate,kan3cha9 choklat
"Ah, the order of eight has arrived","ah, rah wsalt ltartib tmanya"
"You remember the recipe, don't you?","kat39al 3la lwaSfa, yak?"
Oh dear!,3azizi
I'm not sure I remember it,mamt2akdach bila 3a9la 3liha
You will need to refresh my memory,ghadi ta7taj tfakarni
It's very simple,rah sa8la bzaf
Take a melon,khod mnouna
cut it in two,9TTa3ha 3la jouj
remove the seeds,7iyyed zrri3a
get a spoon,jib m3il9a
Put the flesh in the blender,dir lob f lkhlaT
Then what do you put in the blender?,o mn b3d achno kadir flkhallaT?
I put in some lemon juice and a little water,kandir chwya dyal 3aSir limon o chwiya dyal lma
Is that right?,wach hadchi li kayn
More mint leaves,lmazid mn lwra9 dyal na3na3
I forgot about the mint leaves.,nsit lwra9 dyal na3na3
"I need to be careful not to add too many though",khasni nrad lbal bach manzidch bzaf
All you have to do is train,lhaja lwa7ida li khasak hia tadrib
What do you say?,ach katgol?
That looks perfect,hadchi kayban mitali
Should I garnish it with anything else?,wach khas tzayanha bchi 7aja khra?
"No, no, it's no use","la, la, makaynch lach"
"It's good like this, light, fresh!","rah zwin b7al hakka, khfif, o Tayab"
Send it to the gym,siftha l la salle
Next order,Talab ttani
That's easy!,hada sa8l
Do you want me to let you do it?,wach bghiti nkhalik dirha?
I can do that easily,na9dar n7ayad hadchi bzarba
I didn't quite understand that question,mafhamch had so2al mzyan
What do you mean by toppings?,ach kat9sad b toppings
"Presentation is important, isn't it?","l3ard mohim, kayna?"
"Yeah, that's a great idea","ah, fikra zwina"
Do it and send it to the gym,dirha o siftha l la salle
"I'm afraid that's the end of my shift now","khayf tkon hadi hiya nihaya dyal nobti daba"
Good night,masa2 lkhir
I've learned a lot from you this evening,ta3almt mnk bzaf had l3chiya
"Welcome back, and see you tomorrow!","marhaba brjo3 dyalk, nchofk ghda"
"Hi, I'm having coffee with an orange juice, please.",ahlan bghit l9ahwa m3a 3asir limon 3afak
would you like milk with your coffee and ice in your orange juice?,wach bghiti l7lib m3a l9ahwa o talj m3a limon?
No thanks no milk in my coffee and no ice in the orange juice.,"la chokran, la 7lib fl9ahwa la talj fl3aSir"
Here you are,hanta
Would you like to order any food?,wach bghiti Tlab chi makla?
Our special dish today is chicken,Taba9 dyalna lmomayaz lioma howa djaj
"No, thank you",la chokran
Just coffee,ghir l9ahwa
Chicken pie?,faTira dyal djaj
It's very original,rah aSli bzaf
You can always change your mind!,dima ta9dar tbadal ra2yak
Is that your dog that's just wandered in over there?,wach hada kalbak likaydor tma?
It seems to be looking for someone,ban liya kay9alab 3la chi 7ad
Cream chicken?,djaj blkrima?
Amazing!,modhich
"If it is yours, I'm afraid we don't allow dogs in our bar for hygiene reasons","ila kan dyalk, rah makansma7och blklab 7na f l7ana l2asbab dyal naDafa"
"Sorry, but the dog in question is not mine!","sma7 liya, walakin dak lkalb machi dyali"
"Hhmmmn, hold on while I put it outside","hmmm, tsana 7ta nkharjo brra"
"Poor thing, it's raining too and looks hungry","maskin, rah kati7 chta o ban liya ji3an"
I don't mind having a dog with us,machi mochkil ykon m3ana kalb
He's probably better off with us than outside,imkan 7san ykon m3ana 3la bra
Are you enjoying your coffee,wach katmata3 b9ahwtak?
You think your dog will like chicken pie?,wach kadan kalbak ghadi yabghi faTira dyal djaj?
I'm not sure,mamt2akadch
Your coffee's not bad,98iwtk makhaybach
I also asked for an orange juice,kifma tlabt 3aSir limon
"Oh yes, sorry I forgot.","oh ah, sma7 liya nsit"
"Here's your bill, it comes to 15 dhs","hahiya fatora dyalk, waslat 15 dhs"
"Hey, it's my birthday","ahya, rah 3id miladi"
Don't you want to help me set something up?,mabghitich t3awni n9ad chi 7aja?
"I said I would, didn't I?","galt bila ghadi ndir, kayna?"
So here I am,ewa hani
What do you want me to do?,ach bghitini ndir?
I was thinking about doing this next Saturday,kant kanfakar ndirha nhar sabt jay
Maybe a restaurant?,imkn maT3am?
Oh,oh
I thought it was today,kan ys7ab liya lyoum
I'm busy Saturday,an machghol sabt
That's a problem,hadi mochkila
That's a problem,hada mochkil
"Oh, man.",awdiii
"My birthday is today, but I thought there'd be more people on the weekends","3id miladi lyoum, walakin kanDn ghdi ykon bzaf dyal bnadam f 3oTla dyal nihaya osbo3"
Can we reschedule for Sunday?,wach n9adro n3awdo n7addo maw3id nhar l7ad?
Well as we've not scheduled the party yet we don't have to reschedule it,ewa mlli mazal mazggina l7afla maghadich ikhssna n3awdo nzggiw
We can just invite people on the Sunday,n9adro ghir n3ardo 3la nas nhar l7ad
Do you have a favourite restaurant?,wach 3andak chi maT3am mofaDal?
Oh and are you paying for everything?,oh wach katkhals kolchi?
Do you know a good one?,wach kat3raf chi fikra mazyana?
It's not too expensive in general,rah maghalyach bzaf 3adatan
There's that new Italian place,kayn dak lblasa talyaniya jdida
I'm not clear about who's paying,ma3raftch chkon ghadi ykhalas
Do you want your guests to pay for their own meal or will you pay for eveything?,wach bghiti Doyof dyalk ykhalso maklthom wla ghadi tkhalas nta kolchi?
"If it's not too expensive","ila makantch ghalya"
But I don't like Italians too much,walakin makanbghich talyaniyin bzaf
That sounds like a good plan,katban liya khoTa mzyana
So a cheap French place,idan blasa faranciya rkhisa
You know an Indonesian restaurant?,wach kat3raf chi maT3am indonisi?
What do you mean by the Thai?,ach kat9sad b Thai?
We could invite our yoga group and the Glee Club,n9adro n3ayto 3la lmajmo3a dyal yoga dyalna o Glee club
A Thai restaurant,maT3am taylandi
I know a couple of Thai restaurants but they're not cheap,kan3raf chi maTa3im taylandiyin walakin markhasch
Don't you know anywhere?,wach makat3raf 7ta blasa?
I think there's one in the old harbor,kandan kayna wa7da f lmarfa2 l9dim
I'll look into it,ghadi nTell 3liha
Yes I'll do that,ah ghadi ndirha
Can I invite them all?,wach na9dar n3rad 3lihom kamlin?
There's over thirty people in the yoga class,kayn ktar mn tlatin chakhs f faSl yoga
"Oh, no!",oh la
Tuesday's band,lfar9a dyal tlat
"You know, it's only 8 on Tuesday","kif kat3raf, hir 8 safi nhar tlat"
The rest of us don't know them so well,lba9iy mnna makay3arfohomch mzyan
I take care of the restaurant and you invite the friends,ana ntkllf blmaT3am o t3ayat 3la S7ab
and we'll talk about it tomorrow?,o ghadi nhadro 3lih ghda?
Oh them!,oh homa!
Glad I asked,far7an 7it sawalt
Yes I'll get in touch with them for you,"ah, ghadi natwasal m3ahom 3la 9ablak"
You could use my flat,ta9dar tsta3mal cho99a dyali
That's a great idea!,hadi fikra ra2i3a
You wouldn't mind?,maghadich tbrzT?
And Gerard might come along,ya9dar yji 7ta Gerard
You never know,ma3amrak ta3raf
If you know what I mean,ila 3rafti ach bghit na9sad
"Great, let's do it this way!","3aDim, khlina ndiroha bhad Tari9a"
And we can cook together in the morning!,o n9adro nTaybo lmakla bjoj fsbah
I can't wait!,ma9adarch ntsana
Can I talk to you tomorrow to complete the organization?,wach na9dar nahdar m3ak ghda bach nkamlo tanDim
Cook?,Tyab?
That might be a problem,hadchi i9dr ikhl9 mochkil
But I haven't got time to tell you why,walakin ma3ndich lwa9t bach ngolik 3lach
How about ordering Thai food from that restaurant?,ach ban lik f Talab lmakla taylandiya mn had lmaT3am?
I have to go!,khasni namchi
Let's speak tomorrow,nhadro ghda
We'll find a solution,ghadi nal9aw 7al
See you tomorrow!,nchofak ghda
Have I ever seen you around that pond?,wach fayt chaftak 7da dik lbirka?
Wasn't it yesterday?,makantch lbar7?
maybe,momkin
i tend to keep to myself,kanbghi n7tafaD brasi
"I do come here every day so you probably did see me","ana kanji hna kol nhar dakchi 3lach t9dr tkon chaftini"
"I like to come to this park, too","3ziz 3lia nji lhad l7adi9a, tahia"
I think the place is really quiet,kanDn had lmkan hadi2 bzaf
I just wish they hadn't put in the playground over on the other side,kantmana kon madaroch lmal3ab fjiha lokhra
"the children are so noisy, I'm afraid they are going to scare away the ducklings","drari kaydiro sda3 bzaf, o kankhaf ykhal3o lfrakh dyal lbaT"
I think they're planning a soccer game today between the city's different neighborhoods,kanDn kaykhaTo lmobarat fkora l9adam bin a7ya2 dyal lmdina
what?!,kifach?
that's ludicrous!,hadchi sakhif
there are stadiums for that sort of shenanigans,kaynin mala3ib lhad naw3 dyal lkhoda3
I believe the new municipal team wants to promote exchange,kanDn lfari9 lbaladi jdid bgha t3ziz tabadol
exchange programmes with foreign students?!,baramij tabadol m3a Tolab?
what kind of exchange do you mean?,achmn naw3 dyal tabadol kat9sad?
Not even close,machi 7ta 9riba
Just the children of the different neighborhoods,ghir drari dyal a7ya2 lmakhtalfa
well that's nice,wakha hadchi zwin
I just hope they don't make too much of a ruckus,kantmana ghir maydiroch bzaf dyal sda3
There you go,hanta
It's true that security issues have gone up,bsah lmachakil l2amniya rtaf3at
i hope it works,kantmana yakhdam
That's right,bsah
We're all forced to live together,7na kamlin bzzez 3lina n3icho m3a ba3diyatna
"as they say, if you don't like living here, then go live elsewhere","kif kaygolo, ila kanti makatbghich t3ich 8na, sir 3ich f blasa khra"
"When we were born here, it's hard to go to another country","mnin twladna hna, S3ib nmchiw lblad khra"
We're losing all its landmarks,kankhasro ga3 lma3alim dyalha
"landmarks, like the pond and the park?",ma3alim b7al lbirka o lmontazah?
For example,matalan
Or his doctor's choice,wla lkhiyar dyal Tbib dyalo
It's not easy to find a new doctor that works when you change town,machi sahl tal9a Tbib jdid kaykhdam mnin katghayer lmdina
Or just find a supermarket that sells products I'm used to,wla ghir tl9a super marche kaybi3 lmonatajat liwllft
Do you want an outdoor party as the weather is so good,wach bghiti 7afla 3la berra 7it Ta9s zwin bzaf
"Yes, of course!",ah Tab3an
"I think we should go to the park next, we can have a barbecue.","kanDn khasna nmchiw l7adi9a moraha, n9adro ndiro chwa"
Barbecue or something more sophisticated?,"chwa wla chi 7aja 7san"
"Oh, no, we're between us!",oh la binatna
I'm not planning on inviting the Queen of England!,makankhTaTch n3rad 3la malika dyal inglatira
"Or the new royal couple, haha!","wla l2azwaj lmalakiyan jdad, haha"
I'll wear a very smart dress so it will feel as if I'm at something royal,ghadi nlbas fostan ani9 7ta nwali n7as b7ala f7afla malakiya
"Mind you, I m very happy to be celebrating with you","dir fbalk, ana far7an bzaf n7tafal m3ak"
"Yes, it'll be fun!","ah, ghadi ykon momti3"
You gave me an idea,3titini fikra
Let's make a royal barbecue!,"yalah ndiro 7afl chiwa2 malaki"
The wedding was stunning was'nt it,kan l7afl dyal zwaj modhil awlla
We will have fun too,ghadi ntmat3o 7ta 7na
Shall I organise the barbecue meat and fish,wach ndir chwa dyal l7am o l7ot
Then we could ask friends to bring salads and wine,o n9adro nTalbo mn s7ab yjibo chlaDa o nabid
"Yes, why not!",ah 3lach la
I'm gonna make cake for dessert,ghadi n9ad l7alwa
Chocolate?,choklat?
"Yes, a chocolate cake, and another apple I think.","ah, 7alwa dyal choklat, o tfa7a khra 3la makanDn"
What did you get?,achno khditi?
Very French but much better than our traditional fruit cake,franciya bzaf walakin 7san bzaf mn l7alwa lfakiha ta9lidiya
Luck!,zhar
You think I should do that?,wach kadan khasni ndir dakchi?
Are you going to wear a princess crown?,wach ghadi talbas taj dyal amira?
Sorry I don't understand what you mean,sma7 liya mafhamtch ach kat3ni
"Yeah, I think I'm gonna wear a nice solid gold tiara, with a lot of diamonds!","ah, kanDn ghadi nlbas taj mn dhab lkhaliS, m3a bzaf dyal almas"
It's gonna be really beautiful,ghadi tkon zwina bzaf
"I was talking about dessert, but I think I'm gonna make it easier for you","kant kanhdar 3la l7alwa, walakin kanDn bila ghadi nkhali l2amr sahl lik"
"Good lord, I hope there won't be any strange people in the park",yarbi kantmana maykon 7ta 7ad ghrib f l7adi9a
"About the meat and fish, I'm also going to take a few things for vegetarians","dakchi likayt3ala9 blo7om o l7ot, ghadi nakhod chwiya dyal l7wayj khrin l nabatiyin"
You never know!,mat3raf!
We might be mugged!,y9adro ysar9ona
Haha,haha
"Yes, that's for sure!","ah, hadchi mo2akad"
"Perhaps you could bring a sword, as a true knight of the Crown!","n9adro njibo sif, b7al faris 7a9i9i ltaj"
Sorry so slow but I m on my phone,sma7 liya m3atal walakin ana f tilifon
"Come on, let's do it this way!","aji, khlina ndiroha bhad Tari9a"
Thank you so much for your help,chokran 3la lmosa3ada dyalk
this weekend then!,fnihaya dyal simana idan
So what made your day so bad today?,achno khla nharak khayb bzaf lyoum?
Did you have time to take lunch?,wach kan 3andak lwa9t bach takol lghda?
The day had begun,nnhar bda
"Yes, I was able to have lunch","ah, rah 9drt nakol lghda"
In the garage,f lgarage
This morning my car broke down,had sbah khasrat liya syara dyali
This morning my car broke down,had sbah khasrat liya tomobilti
Between two dates,bin joj mawa3id
Oh no poor you,"oh la, mskin"
I hope you didn't get wet,kantmana matkonch fzgti
"As you're now home, I'm assuming that you managed to get the car fixed?","mnin nta fdar daba, kanftaraD bila 9aditi tomobil?"
"No, I had to walk home","la, kan khasni ntmcha ldar"
A real nightmare,kabos 7a9i9i
How much is it going to cost to get the car fixed?,ch7al khs tlflous bach tsayab sayara?
"Not very expensive, but you have to order the spare",machi ghalya bzaf walakin khasak tlab l9ita3 dyal lghiyar
About 200 dhs,ta9riban 200 dhs
Have you got 200 dhs?,wach 3ndak 200 dhs
We could use the holiday money we've put by?,wach n9adro nakhdo lflos dyal l3oTla li7tina
If only that,kon ghir kan ghir hadchi
"Running to catch the bus, I twisted my ankle","jrit bach nchad l7afila, lwit ka7il dyali"
I thought it was looking a bit swollen,kanDn katban manfokha chwiya
You need to get some ice on it,at7taj chwiya dyal talj 3liha
I wanted to call a cab,knt bghit n3ayat 3la taxi
"And when he saw that I was soaking wet, he wouldn't let me in.","omli chaf bli kant sard, makhlanich ndkhal."
Then it pissed me off,otmma tla3 lia dam
How terrible,ch7al khayba
I'm sorry you've had such a bad day,sma7lia 7it dwzti b7al had nhar lkhayb
I started screaming at him,bdit kanghowet 3lih
What did he say then?,achno gal ba3d dakchi?
So it was better,dakchi 3lach kan 7san
Insults,ssbban
Tomorrow I can drive you to work,ghda imkan liya nsog bik lkhdma
what are you talking about?!,3layach kadwi?!
I'm head chef!,ana ra2is dyal tabakhin!
You were meant to get the ingredients,kan khasak takhad lmokawinat
please don't tell me you forgot to go shopping,3afak matgolch lia bli nsiti mamchiti t9dda
what are we going to serve our customers?,achno 7na ghadin n9ddmo lklyan dyalna?
"our hungry, hungry customers!","lklyan dyalna ji3anin, ji3anin!"
But you told me you'd go to the market this morning!,walakin glti lia bli atmchi lso9 had sba7!
Don't we have the ingredients?,wach ma3ndnach lmokawinat?
"anyway, we are clearly in a massive pickle here","lmohim, bayna wach 7na fm29zak kbir 8na"
i guess we'll just have to use leftovers from yesterday,kanDn aykhasna nkhadmo ghir b lmakla lib9at mn lbar7
I hope they don't notice anything wrong,n2amlo mayla7doch 7ta chi khata2
We got five hours till tonight's dinner,3ndna khamsa dyal sway3 7ta l3cha dyal lila
I can go to the super market and see what they got,n9dd nmchiw lso9 nchof ach 3ndhom tmma
"I'm sorry, I misunderstood.","sm7lia, fhamt ghalat"
well you better hurry then because we have prep to do,mn l2a7san tzrab 7it rah 3ndna mandiro mazal
and bully beef takes more than five hours,o l7am lbagri khsso ktar mn khamsa dyal sway3
