darija,eng,darija_ar
koun ghir 9dert n tiri 3la dak teyr de5ya,,كون غير قدرت ن تيري علا داك تير دخيا
koun ghir 9dert n l9a chi wa7ed nchki 3lih,,كون غير قدرت ن لقا شي واحد نشكي عليه
koun ghir 9dert n 7essen men 9rayti,,كون غير قدرت ن حسّن من قرايتي
koun ghir 9dert n gablek,,كون غير قدرت ن ڭابلك
koun ghir 9dert n chri dak lbolissi,,كون غير قدرت ن شري داك لبوليسّي
koun ghir 9dert n charji tilifouni hna,,كون غير قدرت ن شارجي تيليفوني هنا
koun ghir 9dert n b7et fdkchi walakin makanl9a walo,,كون غير قدرت ن بحت فدكشي والاكين ماكانلقا والو
koun ghir 9dert n jib fih dik l9ortassa mat5afch rah labesss gilet,,كون غير قدرت ن جيب فيه ديك لقورتاسّا ماتخافش راه لابسّس ڭيلت
koun ghir 9dert n stow3eb dkchi li kaygoul chi nhar,,كون غير قدرت ن ستووعب دكشي لي كايڭول شي نهار
koun ghir 9dert n chte7 fhad l3erss,,كون غير قدرت ن شتح فهاد لعرسّ
koun ghir 9dert n fi9 de5ya,,كون غير قدرت ن فيق دخيا
koun ghir 9dert n selli m3ahom dima,,كون غير قدرت ن سلّي معاهوم ديما
koun ghir 9dert n3eyet lih ftilifoune walakin ma3endich lwjeh,,كون غير قدرت نعيت ليه فتيليفون والاكين ماعنديش لوجه
koun ghir 9dert n marki 3lihm,,كون غير قدرت ن ماركي عليهم
koun ghir 9dert n zle9 3liha twe3et msiana fiha,,كون غير قدرت ن زلق عليها توعت مسيانا فيها
koun ghir 9dert n manrtakbch ta 5alat f7yati kamla,,كون غير قدرت ن مانرتاكبش تا خالات فحياتي كاملا
koun ghir 9dert n l9a chi 3ayb fih,,كون غير قدرت ن لقا شي عايب فيه
koun ghir 9dert n steb3ed had l7timaliya walakin ymken 5oya howa chfar,,كون غير قدرت ن ستبعد هاد لحتيمالييا والاكين يمكن خويا هووا شفار
koun ghir 9dert n 3derek walakin rak zedti fih,,كون غير قدرت ن عدرك والاكين راك زدتي فيه
koun ghir 9dert n fsser lik ach gelt,,كون غير قدرت ن فسّر ليك أش ڭلت
koun ghir 9dert n nseweb chi journal ou nbi3o,,كون غير قدرت ن نسوب شي جورنال و نبيعو
koun ghir 9dert n tla9a m3ak,,كون غير قدرت ن تلاقا معاك
koun ghir 9dert n tfawed m3ak 3la l2ashom dial charika,,كون غير قدرت ن تفاود معاك علا لأسهوم ديال شاريكا
koun ghir 9dert n 7ellel dak ness flmti7an kima galina l2ostad,,كون غير قدرت ن حلّل داك نسّ فلمتيحان كيما ڭالينا لأستاد
koun ghir 9dert n semik chi smiya dial chi nbiy,,كون غير قدرت ن سميك شي سمييا ديال شي نبيي
koun ghir 9dert n 9ete3 dak serwal,,كون غير قدرت ن قتع داك سروال
koun ghir 9dert n t9elle9 men chi 7edd walakin makadouzch liya,,كون غير قدرت ن تقلّق من شي حدّ والاكين ماكادوزش لييا
koun ghir 9dert n 2ehhel fer9ti,,كون غير قدرت ن ءههل فرقتي
koun ghir 9dert n 5sser ou nthenna,,كون غير قدرت ن خسّر و نتهنّا
koun ghir 9dert n tle9 dak lkelb,,كون غير قدرت ن تلق داك لكلب
koun ghir 9dert n sbe5 dak lbit bhad loun li bagha lwalida,,كون غير قدرت ن سبخ داك لبيت بهاد لون لي باغا لواليدا
koun ghir 9dert n 7edded lik ach baghi,,كون غير قدرت ن حدّد ليك أش باغي
koun ghir 9dert n na5od dik lmin7a lwa3ra,,كون غير قدرت ن ناخود ديك لمينحا لواعرا
koun ghir 9dert n sellefek walakin ma3endich,,كون غير قدرت ن سلّفك والاكين ماعنديش
koun ghir 9dert n bni chi dar b7al hadi,,كون غير قدرت ن بني شي دار بحال هادي
koun ghir 9dert n tfa3el m3ah walakin rani 3eyyan,,كون غير قدرت ن تفاعل معاه والاكين راني عيّان
koun ghir 9dert n 7eyyed 3liya had l3adat l5aybin,,كون غير قدرت ن حيّد علييا هاد لعادات لخايبين
koun ghir 9dert n njih face,,كون غير قدرت ن نجيه فاس
koun ghir 9dert n wjjeh lih chi dedicasse,,كون غير قدرت ن وجّه ليه شي دديكاسّ
koun ghir 9dert n chri chi tyara t7etni fin mabghit,,كون غير قدرت ن شري شي تيارا تحتني فين مابغيت
koun ghir 9dert n 9aad dak tilifoun kolo mferche5,,كون غير قدرت ن قاد داك تيليفون كولو مفرشخ
koun ghir 9dert n chri chi kebda zwina ou bnina,,كون غير قدرت ن شري شي كبدا زوينا و بنينا
koun ghir 9dert n sift lih chi flouss,,كون غير قدرت ن سيفت ليه شي فلوسّ
koun ghir 9dert n tkowwen fhad ljami3a moraha nmchi berra,,كون غير قدرت ن تكووّن فهاد لجاميعا موراها نمشي برّا
koun ghir 9dert n douz men dik l3assifa lmdina la5ra,,كون غير قدرت ن دوز من ديك لعاسّيفا لمدينا لاخرا
koun ghir 9dert n rechdek fin jat lma7atta walakin rani ma3arefch,,كون غير قدرت ن رشدك فين جات لماحاتّا والاكين راني ماعارفش
koun ghir 9dert n 9ne3ek ana hadchi machi s7i7,,كون غير قدرت ن قنعك أنا هادشي ماشي سحيح
koun ghir 9dert n 5dem ftedrib ou nhenni rassi,,كون غير قدرت ن خدم فتدريب و نهنّي راسّي
koun ghir 9dert n 9ewwi lcv diali,,كون غير قدرت ن قوّي لكڤ ديالي
koun ghir 9dert n do99 men hadchi walakin ra n9der nredd,,كون غير قدرت ن دوقّ من هادشي والاكين را نقدر نردّ
koun ghir 9dert n 3eyyet 3lih yji l7efla,,كون غير قدرت ن عيّت عليه يجي لحفلا
koun ghir 9dert n t5ella 3liha,,كون غير قدرت ن تخلّا عليها
koun ghir 9dert n jawebek,,كون غير قدرت ن جاوبك
koun ghir 9dert n dir rassi kantre3ed bach na5od lfota mli ntle3 men lb7er,,كون غير قدرت ن دير راسّي كانترعد باش ناخود لفوتا ملي نتلع من لبحر
koun ghir 9dert n fixi chi hadaf ou nwsel lih,,كون غير قدرت ن فيشي شي هاداف و نوسل ليه
koun ghir 9dert n tdaaher bl5ina walakin ra ma3endich bach,,كون غير قدرت ن تداهر بلخينا والاكين را ماعنديش باش
koun ghir 9dert n chawerek fhadchi walakin dkchi sirri,,كون غير قدرت ن شاورك فهادشي والاكين دكشي سيرّي
koun ghir 9dert n 9sem m3ak had lflouss li 3endi,,كون غير قدرت ن قسم معاك هاد لفلوسّ لي عندي
koun ghir 9dert n n5aret fhadchi,,كون غير قدرت ن نخارت فهادشي
koun ghir 9dert n 7e99e9 dkchi lii bagha liya lwalida,,كون غير قدرت ن حقّق دكشي ليّ باغا لييا لواليدا
koun ghir 9dert mandihach fl9anoun,,كون غير قدرت مانديهاش فلقانون
koun ghir 9dert n n7eyyed 3luiya had l3amaliya mat3ref nse7 ta bla biha,,كون غير قدرت ن نحيّد علوييا هاد لعامالييا ماتعرف نسح تا بلا بيها
koun ghir 9dert n jib lik chi cado zwin,,كون غير قدرت ن جيب ليك شي كادو زوين
koun ghir 9dert n sifet lih chi messaje walakin ma3endich conenxion,,كون غير قدرت ن سيفت ليه شي مسّاج والاكين ماعنديش كوننشيون
koun ghir 9dert n dfe3 dak derri men tri9,,كون غير قدرت ن دفع داك درّي من تريق
koun ghir 9dert n jessed ayi dewr 3tawh liya ftemtil 7it baghi ghir lflouss,,كون غير قدرت ن جسّد أيي دور عتاوه لييا فتمتيل حيت باغي غير لفلوسّ
koun ghir 9dert n 7asserhoum men jiha le5ra walakin ljiych dialhom s7a7,,كون غير قدرت ن حاسّرهوم من جيها لخرا والاكين لجييش ديالهوم سحاح
koun ghir 9dert n l5i had lchtirak li mdayr dial lconnexion,,كون غير قدرت ن لخي هاد لشتيراك لي مداير ديال لكونّشيون
koun ghir 9dert n 7eweel floussi kamli lhad l3omla,,كون غير قدرت ن حويل فلوسّي كاملي لهاد لعوملا
koun ghir 9dert n t9a3ed bekri,,كون غير قدرت ن تقاعد بكري
koun ghir 9dert n n9ad 5demti ou nsewer menha flouss n3ich bihom ta mora mant9a3ed,,كون غير قدرت ن نقاد خدمتي و نسور منها فلوسّ نعيش بيهوم تا مورا مانتقاعد
koun ghir 9dert n sheel 3lik l5edma,,كون غير قدرت ن سهيل عليك لخدما
koun ghir 9dert n kobb lik dak l3assir walakin ra sala,,كون غير قدرت ن كوبّ ليك داك لعاسّير والاكين را سالا
koun ghir 9dert n nsej lik chi tricowat,,كون غير قدرت ن نسج ليك شي تريكووات
koun ghir 9dert n t3awen m3ak walakin ta ana 5assni li yt3awen m3aya,,كون غير قدرت ن تعاون معاك والاكين تا أنا خاسّني لي يتعاون معايا
koun ghir 9dert n trassi msian dak chkkel felwer9a,,كون غير قدرت ن تراسّي مسيان داك شكّل فلورقا
koun ghir 9dert n sejjelek fdak lclub,,كون غير قدرت ن سجّلك فداك لكلوب
koun ghir 9dert n 7seb msian,,كون غير قدرت ن حسب مسيان
koun ghir 9dert n 7ffezek,,كون غير قدرت ن حفّزك
koun ghir 9dert n imprimi douk lwra9i kamlin,,كون غير قدرت ن إمپريمي دوك لوراقي كاملين
koun ghir 9dert n 7eyyed 3liya tawattour,,كون غير قدرت ن حيّد علييا تاواتّور
koun ghir 9dert n 3yyenek,,كون غير قدرت ن عيّنك
koun ghir 9dert n dwi m3ak fhad lmawdou3,,كون غير قدرت ن دوي معاك فهاد لماودوع
koun ghir 9dert n 3tard 3la dak l9arar,,كون غير قدرت ن عتارد علا داك لقارار
koun ghir 9dert n yesser lik f5demtek,,كون غير قدرت ن يسّر ليك فخدمتك
koun ghir 9dert n chri ga3 dkchi li 5assni,,كون غير قدرت ن شري ڭاع دكشي لي خاسّني
koun ghir 9dert n 7bes lgaro de5ya,,كون غير قدرت ن حبس لڭارو دخيا
koun ghir 9derna nt7amaw 3lih,,كون غير قدرنا نتحاماو عليه
koun ghir 9dert n t2e9lem m3a had ljew,,كون غير قدرت ن تءقلم معا هاد لجو
koun ghir 9dert n 3god dak l7bel,,كون غير قدرت ن عڭود داك لحبل
koun ghir 9dert n 9tabs bezzaf dil ljomal men had lktab walakin 3endi l7e99 fwe7da,,كون غير قدرت ن قتابس بزّاف ديل لجومال من هاد لكتاب والاكين عندي لحقّ فوحدا
koun ghir 9dert n syter 3lik,,كون غير قدرت ن سيتر عليك
koun ghir 9dert n behrek b5demti,,كون غير قدرت ن بهرك بخدمتي
koun ghir 9dert n fte7 lik chi ma7al,,كون غير قدرت ن فتح ليك شي ماحال
koun ghir 9dert n tlle3 flmochahadat dial vidyowati,,كون غير قدرت ن تلّع فلموشاهادات ديال ڤيديوواتي
koun ghir 9dert n sta9al 3la 3a2ilti,,كون غير قدرت ن ستاقال علا عاإلتي
koun ghir 9dert n dir fiha ta ana kanthejja bach t3aweni l2ostada,,كون غير قدرت ن دير فيها تا أنا كانتهجّا باش تعاوني لأستادا
koun ghir 9dert n 7errek dak l7ayawan,,كون غير قدرت ن حرّك داك لحاياوان
koun ghir 9dert n na5od chi 5elssa idafiya,,كون غير قدرت ن ناخود شي خلسّا إدافييا
koun ghir 9dert nmchi fhad lminwal,,كون غير قدرت نمشي فهاد لمينوال
koun ghir 9dert n rkelek ou nta na3ess bach t7ess biha,,كون غير قدرت ن ركلك و نتا ناعسّ باش تحسّ بيها
koun ghir 9dert n lbes dik lkeswa ou n5rej biha walakin ra 3eyb,,كون غير قدرت ن لبس ديك لكسوا و نخرج بيها والاكين را عيب
koun ghir 9dert n diklari bik,,كون غير قدرت ن ديكلاري بيك
koun ghir 9dert n 2ekked lik 3la dkchi li kangoul,,كون غير قدرت ن ءكّد ليك علا دكشي لي كانڭول
koun ghir 9dert n d5el men had lbab,,كون غير قدرت ن دخل من هاد لباب
koun ghir 9dert n 2ejjel lik lmaw3id dialek m3a tbib,,كون غير قدرت ن ءجّل ليك لماوعيد ديالك معا تبيب
3lach mabghitich t fekker fhad lblan yakma t3e9edti menou,,علاش مابغيتيش ت فكّر فهاد لبلان ياكما تعقدتي منو
3lach mabghitich t tbda felmoraja3a,,علاش مابغيتيش ت تبدا فلموراجاعا
3lach mabghitich t 3tamed had lmo9araba li wraha lina l2ostad,,علاش مابغيتيش ت عتامد هاد لموقارابا لي وراها لينا لأستاد
3lach mabghitich t rejje3 lih flousso yak sellfek oula yakma nkertih,,علاش مابغيتيش ت رجّع ليه فلوسّو ياك سلّفك ولا ياكما نكرتيه
3lach mabghitich t 5rej dik lmes2ala.,,علاش مابغيتيش ت خرج ديك لمسألا.
3lach mabghitich t soug had tonobil,,علاش مابغيتيش ت سوڭ هاد تونوبيل
3lach mabghitich t bni chi dar kbira b7al hadi,,علاش مابغيتيش ت بني شي دار كبيرا بحال هادي
3lach mabghitich t gelbou,,علاش مابغيتيش ت ڭلبو
3lach mabghitich t trini flgodron,,علاش مابغيتيش ت تريني فلڭودرون
3lach mabghitich t stetmer fhad lma7al,,علاش مابغيتيش ت ستتمر فهاد لماحال
3lach mabghitich t chri had lprodwi li kayre5wi msian,,علاش مابغيتيش ت شري هاد لپرودوي لي كايرخوي مسيان
3lach mabghitich t douz men l7odod,,علاش مابغيتيش ت دوز من لحودود
3lach mabghitich t wedde7 liya ach w9e3,,علاش مابغيتيش ت ودّح لييا أش وقع
3lach mabghitich t mlek bezzaf dial dyour,,علاش مابغيتيش ت ملك بزّاف ديال ديور
3lach mabghitich t t7eddah yakma 3arfou 5ayreb7ek,,علاش مابغيتيش ت تحدّاه ياكما عارفو خايربحك
3lach mabghitich t mender fhad lblassa chjkon b7alek jay liha,,علاش مابغيتيش ت مندر فهاد لبلاسّا شجكون بحالك جاي ليها
3lach mabghitich t 7aawer m3ah wach 7it kayt3esseb bezzaf,,علاش مابغيتيش ت حاور معاه واش حيت كايتعسّب بزّاف
3lach mabghitich t tselle9 dik chejra yakma fiha chouk,,علاش مابغيتيش ت تسلّق ديك شجرا ياكما فيها شوك
3lach mabghitich t dwi 3la lmochkil li tra lik,,علاش مابغيتيش ت دوي علا لموشكيل لي ترا ليك
3lach mabghitich t 7aafed 3la 7wayjek,,علاش مابغيتيش ت حافد علا حوايجك
3lach mabghitich t zre3 lih l9elb yakma 3aref l3amaliya ma5atnje7cj,,علاش مابغيتيش ت زرع ليه لقلب ياكما عارف لعامالييا ماخاتنجحكج
3lach mabghitich t 7wwel lih lflouss flbanka,,علاش مابغيتيش ت حوّل ليه لفلوسّ فلبانكا
3lach mabghitich t le5ess dik l9issa yakma ma3ajbakch,,علاش مابغيتيش ت لخسّ ديك لقيسّا ياكما ماعاجباكش
3lach mabghitich t tiri fdak teyr yakma b9a fik,,علاش مابغيتيش ت تيري فداك تير ياكما بقا فيك
3lach mabghitich t cheka 3liya,,علاش مابغيتيش ت شكا علييا
3lach mabghitich t 7essen men 7yatek,,علاش مابغيتيش ت حسّن من حياتك
3lach mabghitich t gabel wladek,,علاش مابغيتيش ت ڭابل ولادك
3lach mabghitich t chri dak lmotor,,علاش مابغيتيش ت شري داك لموتور
3lach mabghitich t charji tilifounek,,علاش مابغيتيش ت شارجي تيليفونك
3lach mabghitich t b7et fhadchi,,علاش مابغيتيش ت بحت فهادشي
3lach mabghitich t stow3eb hadchi li kangoul lik,,علاش مابغيتيش ت ستووعب هادشي لي كانڭول ليك
3lach mabghitich t chte7 fhad l3erss,,علاش مابغيتيش ت شتح فهاد لعرسّ
3lach mabghitich t fi9 bekri ou nta dima mwalfa lik,,علاش مابغيتيش ت فيق بكري و نتا ديما موالفا ليك
3lach mabghitich t selli,,علاش مابغيتيش ت سلّي
3lach mabghitich t chri tilifoune,,علاش مابغيتيش ت شري تيليفون
3lach mabghitich t marki 3lihoum,,علاش مابغيتيش ت ماركي عليهوم
3lach mabghitich t te9tel dima kant mwalfa lik,,علاش مابغيتيش ت تقتل ديما كانت موالفا ليك
3lach mabghitich t 9eleb 3la dkchi li day3 lik,,علاش مابغيتيش ت قلب علا دكشي لي دايع ليك
3lach mabghitich t steb3ed had l7timal,,علاش مابغيتيش ت ستبعد هاد لحتيمال
3lach mabghitich t 3der 5ouk 3adi rah kay5let,,علاش مابغيتيش ت عدر خوك عادي راه كايخلت
3lach mabghitich t fsser liya had lblan,,علاش مابغيتيش ت فسّر لييا هاد لبلان
3lach mabghitich t chri dak lktab,,علاش مابغيتيش ت شري داك لكتاب
3lach mabghitich t laa9a m3ah yakma tra binatkom chi mochkil,,علاش مابغيتيش ت لاقا معاه ياكما ترا بيناتكوم شي موشكيل
3lach mabghitich t tfawed m3ah rah kaynezel ftaman,,علاش مابغيتيش ت تفاود معاه راه كاينزل فتامان
3lach mabghitich t 7ellel dkchi li gal lik ra bayn ach ki3ni bhdertou,,علاش مابغيتيش ت حلّل دكشي لي ڭال ليك را باين أش كيعني بهدرتو
3lach mabghitich t semih chi smiya 3arabiya,,علاش مابغيتيش ت سميه شي سمييا عارابييا
3lach mabghitich t dir chwiya dial tes5inat 9bel mn lmatch,,علاش مابغيتيش ت دير شوييا ديال تسخينات قبل من لماتش
ila madertich tes5inat 5atwe3et flmatch,,إلا مادرتيش تسخينات خاتوعت فلماتش
3lach mabghitich t t9elle9 3lih ou ana dima m9elle9 3liya,,علاش مابغيتيش ت تقلّق عليه و أنا ديما مقلّق علييا
3lach mabghitich t 2ehhel fer9tek yakma binek ou bin l2oidara dialha chi mochkil,,علاش مابغيتيش ت ءههل فرقتك ياكما بينك و بين لأيدارا ديالها شي موشكيل
3lach mabghitich t 5sser floussek 3la lmchro3 dialek,,علاش مابغيتيش ت خسّر فلوسّك علا لمشروع ديالك
3lach mabghitich t tle9 rassek chwiya ou d7ek m3a nass,,علاش مابغيتيش ت تلق راسّك شوييا و دحك معا ناسّ
3lach mabghitich t sbe5 dak lbit ra kolo kayt9echcher,,علاش مابغيتيش ت سبخ داك لبيت را كولو كايتقشّر
3lach mabghitich t 7edded liya ach baghi,,علاش مابغيتيش ت حدّد لييا أش باغي
3lach mabghitich t 3awenni te3tini dik lmin7a,,علاش مابغيتيش ت عاونّي تعتيني ديك لمينحا
3lach mabghitich t sellefou flouss yakma makayreje3ch,,علاش مابغيتيش ت سلّفو فلوسّ ياكما ماكايرجعش
3lach mabghitich t bni chi dwira b7al s7abel kamlin yakma mzyyer men na7it lflouss,,علاش مابغيتيش ت بني شي دويرا بحال سحابل كاملين ياكما مزيّر من ناحيت لفلوسّ
3lach mab5ach dak lmokawin ytfa3el m3a la5or,,علاش مابخاش داك لموكاوين يتفاعل معا لاخور
3lach mabghitich ydi had lbotola,,علاش مابغيتيش يدي هاد لبوتولا
3lach mabghitich yderbrek frassek,,علاش مابغيتيش يدربرك فراسّك
3lach mabghitich t wjjeh wladek l5ir,,علاش مابغيتيش ت وجّه ولادك لخير
3lach mabghitich t chri chi tyara zwina,,علاش مابغيتيش ت شري شي تيارا زوينا
3lach mabghitich t 9aad liya had lmochkil ou tl9a liya chi 7ell,,علاش مابغيتيش ت قاد لييا هاد لموشكيل و تلقا لييا شي حلّ
3lach mabghitich t tkebbed ga3 l5asa2ir ou katlesse9hom fla5rin,,علاش مابغيتيش ت تكبّد ڭاع لخاساإر و كاتلسّقهوم فلاخرين
3lach mabghitich t sifet liya ta messaje dima m5elini vu,,علاش مابغيتيش ت سيفت لييا تا مسّاج ديما مخليني ڤو
3lach mabghitich t tkowwen rassek fchhi jami3a ou dir chi 7erfa,,علاش مابغيتيش ت تكووّن راسّك فشهي جاميعا و دير شي حرفا
3lach mabghitich t 5rej fha l3asifa,,علاش مابغيتيش ت خرج فها لعاسيفا
3lach mabghitich t 5rej m3a dak rajel yakma dar lik chi 7aja,,علاش مابغيتيش ت خرج معا داك راجل ياكما دار ليك شي حاجا
3lach mabghitich tet9tane3 ana dkchi li katgoul 5a;lat,,علاش مابغيتيش تتقتانع أنا دكشي لي كاتڭول خا;لات
3lach mabghitich t d5el majal tedrib,,علاش مابغيتيش ت دخل ماجال تدريب
3lach mabghitich t 9ewwi rassek bmakla si77iya,,علاش مابغيتيش ت قوّي راسّك بماكلا سيحّييا
3lach mabghitich t do99 had lmomala7at ra ana li msewbahoum,,علاش مابغيتيش ت دوقّ هاد لمومالاحات را أنا لي مسوباهوم
3lach mabghitich t 3eyyet 3lih l3cha,,علاش مابغيتيش ت عيّت عليه لعشا
3lach mabghitich t t5ella 3la walidik rahom men dima ou homa m3debinek,,علاش مابغيتيش ت تخلّا علا واليديك راهوم من ديما و هوما معدبينك
3lach mabghitich t jaweb m3aya,,علاش مابغيتيش ت جاوب معايا
3lach mabghitich t fixi chi hadaf ou taaber bach twsel lih,,علاش مابغيتيش ت فيشي شي هاداف و تابر باش توسل ليه
3lach mabghitich t tdaaher bchi 7aja ma3endekch,,علاش مابغيتيش ت تداهر بشي حاجا ماعندكش
3lach mabghitich t chawerni,,علاش مابغيتيش ت شاورني
3lach mabghitich t 9sem m3aya dik lkika,,علاش مابغيتيش ت قسم معايا ديك لكيكا
3lach mabghitich t n5aret ou tchri ashom fhad charika,,علاش مابغيتيش ت نخارت و تشري أسهوم فهاد شاريكا
3lach mabghitich t 7e99e9 dkchi li baghi,,علاش مابغيتيش ت حقّق دكشي لي باغي
3lach mabghitich t tebe3 dak l9anoun,,علاش مابغيتيش ت تبع داك لقانون
3lach mabghitich t dir dik l3amaliya 7it ze3ma 5atira,,علاش مابغيتيش ت دير ديك لعامالييا حيت زعما خاتيرا
3lach mabghitich t jib liya chi no9ta zwina,,علاش مابغيتيش ت جيب لييا شي نوقتا زوينا
3lach mabghitich t dwi m3aya yakma dert lim chi 7aja,,علاش مابغيتيش ت دوي معايا ياكما درت ليم شي حاجا
3lach mabghitich t def3ou men lbalco kifma mtaf9in,,علاش مابغيتيش ت دفعو من لبالكو كيفما متافقين
3lach mabghitich t jessed dak dawr yakma fih chi 7aja mo5illa lil 7aya2,,علاش مابغيتيش ت جسّد داك داور ياكما فيه شي حاجا موخيلّا ليل حاياء
3lach mabghitich t k5i ga3 dkchi lmdayr,,علاش مابغيتيش ت كخي ڭاع دكشي لمداير
3lach mabghitich t rbe7 bezzaf dial lflouss,,علاش مابغيتيش ت ربح بزّاف ديال لفلوسّ
3lach mabghitich t t9a3d,,علاش مابغيتيش ت تقاعد
3lach mabghitich t shhel 3lih 5demtou meskin,,علاش مابغيتيش ت سههل عليه خدمتو مسكين
3lach mabghitich t kobb lih lma,,علاش مابغيتيش ت كوبّ ليه لما
3lach mabghitich t nsej chi trico,,علاش مابغيتيش ت نسج شي تريكو
3lach mabghitich t rje3 lmdintek,,علاش مابغيتيش ت رجع لمدينتك
3lach mabghitich t dir dik l7ssana dial chamkriya,,علاش مابغيتيش ت دير ديك لحسّانا ديال شامكرييا
3lach mabghitich t 7seb rassek men l3a2ila,,علاش مابغيتيش ت حسب راسّك من لعاإلا
3lach mabghitich t 7ffez l3aba bflouss,,علاش مابغيتيش ت حفّز لعابا بفلوسّ
3lach mabghitich t imprimi douk lwra9i yakma sala lmdad,,علاش مابغيتيش ت إمپريمي دوك لوراقي ياكما سالا لمداد
3lach mabghitich t 5rej 3la lmechro3 dial sa7bek rah kinsafsek,,علاش مابغيتيش ت خرج علا لمشروع ديال ساحبك راه كينسافسك
3lach mabghitich t tdreb dak lberhouch yseketena,,علاش مابغيتيش ت تدرب داك لبرهوش يسكتنا
3lach mabghitich t dwi m3aya rani dima mdayr m3ak msian,,علاش مابغيتيش ت دوي معايا راني ديما مداير معاك مسيان
3lach mabghitich t 3tard la dak l9arar li 5rej ra tawa7ed ma3ajbou,,علاش مابغيتيش ت عتارد لا داك لقارار لي خرج را تاواحد ماعاجبو
3lach mabghitich t 9ewwi rassek,,علاش مابغيتيش ت قوّي راسّك
3lach mabghitich t ysser f5demtek,,علاش مابغيتيش ت يسّر فخدمتك
3lach mabghitich t 7bes rassek bach madirch hadchi,,علاش مابغيتيش ت حبس راسّك باش ماديرش هادشي
3lach mabghitich t t2e9lem fhad lvillaje,,علاش مابغيتيش ت تءقلم فهاد لڤيلّاج
3lach mabghitich t 3god syour dial sberdilt sa7bek,,علاش مابغيتيش ت عڭود سيور ديال سبرديلت ساحبك
3lach mabghitich t 9tabs chi jomla men had ness,,علاش مابغيتيش ت قتابس شي جوملا من هاد نسّ
3lach mabghitich t syter 3la mratek,,علاش مابغيتيش ت سيتر علا مراتك
3lach mabghitich t fergue3 dik nefa5a,,علاش مابغيتيش ت فرڭوع ديك نفاخا
