darija,eng,darija_ar
maymkench n t2emmel mnek chcher,,مايمكنش ن تءمّل منك الشر
maymkench n 7dder chi 7elwa ldida,,مايمكنش ن حدّر شي حلوا لديدا
maymkench n tfa3el m3ak,,مايمكنش ن تفاعل معاك
maymkench n btaker chi ferfara b7al hadi,,مايمكنش ن بتاكر شي فرفارا بحال هادي
maymkench n 7ekmek,,مايمكنش ن حكمك
maymkench n 3ezzik ou nta ma3ezzitinich,,مايمكنش ن عزّيك و نتا ماعزّيتينيش
maymkench n dreb had lmasafa kolha,,مايمكنش ن درب هاد لماسافا كولها
maymkench n dowwebhad cheklat f7lib bared,,مايمكنش ن دووّبهاد شكلات فحليب بارد
maymkench n zid 3lik l5edma,,مايمكنش ن زيد عليك لخدما
maymkench n ttekka 3lik ou nta msennen,,مايمكنش ن التكّا عليك و نتا مسنّن
maymkench n tbbe9 chi fikra nta mabaghihach,,مايمكنش ن تبّق شي فيكرا نتا ماباغيهاش
maymkench n rde3 ou ana kbert chwiya,,مايمكنش ن ردع و أنا كبرت شوييا
maymkench n rtabet bik ou nti dima katkedbi 3liya,,مايمكنش ن رتابت بيك و نتي ديما كاتكدبي علييا
maymkench n welli ra2iis dial had charika,,مايمكنش ن ولّي راءيّس ديال هاد شاريكا
maymkench n choufek mrid ou,,مايمكنش ن شوفك مريد و
maymkench n taaber f5demti ou makaynch chkon ymotivini,,مايمكنش ن تابر فخدمتي و ماكاينش شكون يموتيڤيني
maymkench n 7eyyik 3la dkchi li derti,,مايمكنش ن حيّيك علا دكشي لي درتي
maymkench n dmme3 7it hadik lmra li matet matestahelch,,مايمكنش ن دمّع حيت هاديك لمرا لي ماتت ماتستاهلش
maymkench n taaredek 5ay7sabouni cheffar,,مايمكنش ن تاردك خايحسابوني شفّار
maymkench n fsed fhad lblaad,,مايمكنش ن فسد فهاد لبلاد
maymkench n setrek,,مايمكنش ن سترك
maymkench n baarek 3lik,,مايمكنش ن بارك عليك
maymkench n 5tare9 l7it,,مايمكنش ن ختارق لحيت
maymkench n ne99ez fo9 had tonobilat,,مايمكنش ن نقّز فوق هاد تونوبيلات
maymkench n dmej had ta9afa 3edna felblad,,مايمكنش ن دمج هاد تاقافا عدنا فلبلاد
maymkench n derreb had le33ab lme3gaz,,مايمكنش ن درّب هاد لعّاب لمعڭاز
maymkench n stenzef lmajhoudat dialek,,مايمكنش ن ستنزف لماجهودات ديالك
maymkench n chri kimiya makfyach dial makla,,مايمكنش ن شري كيمييا ماكفياش ديال ماكلا
maymkench n9ad chi faradiya machi manti9iya,,مايمكنش نقاد شي فارادييا ماشي مانتيقييا
maymkench n chri chi 7out 5anez,,مايمكنش ن شري شي حوت خانز
maymkench n t9dda men swa9 b7al hadou,,مايمكنش ن تقدّا من سواق بحال هادو
maymkench n tsabe9 m3ak,,مايمكنش ن تسابق معاك
maymkench n chrref bladi b5tira3 b7al hada,,مايمكنش ن شرّف بلادي بختيراع بحال هادا
maymkench n jemmed lma bhad sour3a,,مايمكنش ن جمّد لما بهاد سورعا
maymkench n daawi l5edra li 5aressha bhad dwa,,مايمكنش ن داوي لخدرا لي خارسّها بهاد دوا
darori nkoun masdar ilham dial chi wa7d,,داروري نكون ماسدار إلهام ديال شي واحد
darori ntchaafa.,,داروري نتشافا.
darori ndbet rasse,,داروري ندبت راسّ
darori n kemmel f tri9i,,داروري ن كمّل ف تريقي
darori n 3ddel omori,,داروري ن عدّل أُموري
darori nl9a l sa7bti khdma,,داروري نلقا ل ساحبتي خدما
